<?xml version="1.0" encoding="utf-8"?>
<!DOCTYPE tw-patent-grant SYSTEM "patent.dtd">
<tw-patent-grant dtd-version="A103.1.0">
  <tw-bibliographic-data-grant>
    <volno>41</volno>
    <isuno>16</isuno>
    <kindcode>S</kindcode>
    <publication-reference>
      <document-id>
        <doc-number>D160744</doc-number>
        <kind />
        <date>103/06/01</date>
      </document-id>
    </publication-reference>
    <certificate-number>
      <document-id>
        <doc-number>D160744</doc-number>
        <kind />
        <date />
      </document-id>
    </certificate-number>
    <application-reference appl-type="design">
      <document-id>
        <doc-number>102305373</doc-number>
        <kind />
        <date>102/08/08</date>
      </document-id>
    </application-reference>
    <classification-locarno>
      <main-classification edition="9">02-03</main-classification>
    </classification-locarno>
    <parties>
      <applicants>
        <applicant sequence="1" app-type="applicant">
          <addressbook>
            <chinese-name name-type="">
              <last-name>黃詩銓</last-name>
              <first-name></first-name>
            </chinese-name>
            <english-name name-type="">
              <last-name></last-name>
              <middle-name />
              <first-name />
            </english-name>
            <address>新北市</address>
            <english-country>TW</english-country>
            <english-address>TW</english-address>
          </addressbook>
        </applicant>
      </applicants>
      <inventors>
        <inventor sequence="1" app-type="applicant">
          <addressbook>
            <chinese-name name-type="">
              <last-name>黃詩銓</last-name>
              <first-name></first-name>
            </chinese-name>
            <english-name name-type="">
              <last-name></last-name>
              <middle-name></middle-name>
              <first-name></first-name>
            </english-name>
            <address></address>
            <english-country>TW</english-country>
            <english-address>TW</english-address>
          </addressbook>
        </inventor>
      </inventors>
      <agents></agents>
    </parties>
    <examiners>
      <examiner>
        <chinese-name>
          <last-name>陳慧媛</last-name>
          <first-name />
        </chinese-name>
      </examiner>
    </examiners>
    <priority-claims></priority-claims>
    <tw-bio-deposit></tw-bio-deposit>
    <invention-title>
      <chinese-title>安全帽（一）</chinese-title>
      <english-title />
    </invention-title>
    <refs>
      <ref>
        <country>TW</country>
        <doc-number>D151747</doc-number>
        <kind></kind>
      </ref>
    </refs>
    <application-publication-reference>
      <document-id>
        <doc-number></doc-number>
        <kind />
        <date></date>
      </document-id>
    </application-publication-reference>
  </tw-bibliographic-data-grant>
  <drawings num="">
    <figure>
      <img align="absmiddle" height="562px" width="698px" file="ed10001.JPG" alt="圖式IMG-2/Draw/ed10001.JPG" img-content="tif" img-format="tif" orientation="portrait" inline="yes"></img>
    </figure>
    <figure>
      <img align="absmiddle" height="598px" width="694px" file="ed10002.JPG" alt="圖式IMG-2/Draw/ed10002.JPG" img-content="tif" img-format="tif" orientation="portrait" inline="yes"></img>
    </figure>
    <figure>
      <img align="absmiddle" height="559px" width="678px" file="ed10003.JPG" alt="圖式IMG-2/Draw/ed10003.JPG" img-content="tif" img-format="tif" orientation="portrait" inline="yes"></img>
    </figure>
    <figure>
      <img align="absmiddle" height="591px" width="697px" file="ed10004.JPG" alt="圖式IMG-2/Draw/ed10004.JPG" img-content="tif" img-format="tif" orientation="portrait" inline="yes"></img>
    </figure>
    <figure>
      <img align="absmiddle" height="582px" width="729px" file="ed10005.JPG" alt="圖式IMG-2/Draw/ed10005.JPG" img-content="tif" img-format="tif" orientation="portrait" inline="yes"></img>
    </figure>
    <figure>
      <img align="absmiddle" height="693px" width="640px" file="ed10006.JPG" alt="圖式IMG-2/Draw/ed10006.JPG" img-content="tif" img-format="tif" orientation="portrait" inline="yes"></img>
    </figure>
    <figure>
      <img align="absmiddle" height="772px" width="642px" file="ed10007.JPG" alt="圖式IMG-2/Draw/ed10007.JPG" img-content="tif" img-format="tif" orientation="portrait" inline="yes"></img>
    </figure>
    <drawing-description>
      <p type="p">
        <p>敬請參閱所附圖式，本創作整體係包括帽體、飾體及鏡片。其中，帽體頂部兩側分別具有梭形條狀之側飾體，於飾體設有複數個呈斜狀之透氣孔及按壓開關，兩側飾體後端係以一平板相互連結，帽體頂部前緣係設有與側飾體呈反向，且為三角狀之前飾體，於該前飾體設有透氣孔及按壓開關，帽體前側係具有鏡片，鏡片兩側分別以圓弧之潤飾與帽體連結。其整體均由弧形線條相互潤飾而成，造型新穎前衛，線條俐落，極具流線美感，配合鏡片向下展開時可使整體外觀形成球狀曲線美感，更使得本創作整體外觀呈現出奇特之意匠風采，予人曲線設計創意之美感。</p>
      </p>
      <p type="p">
        <p>將此安全帽配戴於頭部，以供騎乘機車時保護騎乘者頭部安全，且可藉由飾體之透氣孔構成通風效果，避免頭部之悶熱，使配戴更為舒適。</p>
      </p>
      <p type="p">
        <p>整體觀之，本案無論弧面、飾紋皆潤飾得宜，搭配協調，堪稱一兼具實用性及造型美之設計佳作，由於未曾見有類同創作公開在先，爰依法提出新式樣專利之申請。</p>
      </p>
      <p type="p">
        <p>圖面中之色彩為本案不主張設計之部分。</p>
      </p>
    </drawing-description>
  </drawings>
  <claims />
</tw-patent-grant>