<?xml version="1.0" encoding="utf-8"?>
<!DOCTYPE tw-patent-grant SYSTEM "patent.dtd">
<tw-patent-grant dtd-version="A103.1.0">
  <tw-bibliographic-data-grant>
    <volno>41</volno>
    <isuno>16</isuno>
    <kindcode>B</kindcode>
    <publication-reference>
      <document-id>
        <doc-number>I439549</doc-number>
        <kind />
        <date>103/06/01</date>
      </document-id>
    </publication-reference>
    <certificate-number>
      <document-id>
        <doc-number>I439549</doc-number>
        <kind />
        <date />
      </document-id>
    </certificate-number>
    <application-reference appl-type="invention">
      <document-id>
        <doc-number>101130847</doc-number>
        <kind />
        <date>101/08/24</date>
      </document-id>
    </application-reference>
    <classification-ipc>
      <main-classification edition="200601120140220V">C21C1/10</main-classification>
    </classification-ipc>
    <parties>
      <applicants>
        <applicant sequence="1" app-type="applicant">
          <addressbook>
            <chinese-name name-type="">
              <last-name>石川硅石工業股份有限公司</last-name>
              <first-name></first-name>
            </chinese-name>
            <english-name name-type="">
              <last-name>ISHIKAWALITE INDUSTRY, CO., LTD.</last-name>
              <middle-name />
              <first-name />
            </english-name>
            <address></address>
            <english-country>JP</english-country>
            <english-address>JP</english-address>
          </addressbook>
        </applicant>
      </applicants>
      <inventors>
        <inventor sequence="1" app-type="applicant">
          <addressbook>
            <chinese-name name-type="">
              <last-name>吉川紘平</last-name>
              <first-name></first-name>
            </chinese-name>
            <english-name name-type="">
              <last-name>YOSHIKAWA, KOUHEI</last-name>
              <middle-name></middle-name>
              <first-name></first-name>
            </english-name>
            <address></address>
            <english-country>JP</english-country>
            <english-address>JP</english-address>
          </addressbook>
        </inventor>
      </inventors>
      <agents>
        <agent sequence="1" rep-type="agent">
          <addressbook>
            <chinese-name name-type="">
              <last-name>林志剛</last-name>
              <first-name></first-name>
            </chinese-name>
            <address>臺北市</address>
          </addressbook>
        </agent>
      </agents>
    </parties>
    <examiners>
      <examiner>
        <chinese-name>
          <last-name>呂振榮</last-name>
          <first-name />
        </chinese-name>
      </examiner>
    </examiners>
    <priority-claims>
      <priority-claim sequence="1">
        <country>日本</country>
        <doc-number>2012-152586</doc-number>
        <date>20120706</date>
      </priority-claim>
    </priority-claims>
    <tw-bio-deposit></tw-bio-deposit>
    <invention-title>
      <chinese-title>鑄鐵之石墨球狀化處理時的球狀化劑上部的覆蓋材</chinese-title>
      <english-title />
    </invention-title>
    <refs>
      <ref>
        <country>JP</country>
        <doc-number>55-32761</doc-number>
        <kind>A</kind>
      </ref>
      <ref>
        <country>JP</country>
        <doc-number>56-86652</doc-number>
        <kind>A</kind>
      </ref>
      <ref>
        <country>JP</country>
        <doc-number>4-176810</doc-number>
        <kind>A</kind>
      </ref>
    </refs>
    <application-publication-reference>
      <document-id>
        <doc-number>201402826</doc-number>
        <kind />
        <date>103/01/16</date>
      </document-id>
    </application-publication-reference>
  </tw-bibliographic-data-grant>
  <drawings num="第1圖">
    <figure>
      <img align="absmiddle" height="243px" width="424px" file="ed10001.JPG" alt="*圖式IMG-2/Draw/ed10001.JPG" img-content="tif" img-format="tif" orientation="portrait" inline="yes"></img>
    </figure>
    <figure>
      <img align="absmiddle" height="243px" width="409px" file="ed10002.JPG" alt="圖式IMG-2/Draw/ed10002.JPG" img-content="tif" img-format="tif" orientation="portrait" inline="yes"></img>
    </figure>
    <figure>
      <img align="absmiddle" height="234px" width="406px" file="ed10003.JPG" alt="圖式IMG-2/Draw/ed10003.JPG" img-content="tif" img-format="tif" orientation="portrait" inline="yes"></img>
    </figure>
    <figure>
      <img align="absmiddle" height="243px" width="425px" file="ed10004.JPG" alt="圖式IMG-2/Draw/ed10004.JPG" img-content="tif" img-format="tif" orientation="portrait" inline="yes"></img>
    </figure>
    <drawing-description>
      <p type="p">第1圖是顯示粒子徑為1.7mm~5.0mm之本發明的覆蓋材的熔融鑄鐵的反應後的石墨球狀化的組織照片。</p>
      <p type="p">第2圖是顯示粒子徑為0.1mm~0.3mm之本發明的覆蓋材的熔融鑄鐵的反應後的石墨球狀化的組織照片。</p>
      <p type="p">第3圖是顯示粒子徑為0.1mm以下且0.1~0.3mm(1/1)的本發明的覆蓋材的熔融鑄鐵的反應後的石墨球狀化的組織照片。</p>
      <p type="p">第4圖是顯示使用衝孔碎屑之傳統的覆蓋材的熔融鑄鐵的反應後的石墨球狀化的組織照片。</p>
    </drawing-description>
  </drawings>
  <claims>
    <claim id="clm1" num="1">
      <p type="claim-text">一種鑄鐵之石墨球狀化處理時的球狀化劑上部的覆蓋材，其特徵為：是火山性矽酸鹽礦物，製作成多孔質的粒子，且含有：SiO<sub>2</sub>
為70~75重量%、Al<sub>2</sub>
O<sub>3</sub>
為12~14重量%、K<sub>2</sub>
O為3~5重量%、Na<sub>2</sub>
O為3~4重量%、CaO為0.7~1.5重量%、Fe<sub>2</sub>
O<sub>3</sub>
為1.2~1.5重量%、MgO為0.1~0.2重量%、TiO<sub>2</sub>
為0.05~0.1重量%。</p>
    </claim>
    <claim id="clm2" num="2">
      <p type="claim-text">如申請專利範圍第1項所述的鑄鐵之石墨球狀化處理時的球狀化劑上部的覆蓋材，其比重為0.5~1.0g/cm<sup>3</sup>
，而且是直徑5mm以下的多孔質的粒狀體。</p>
    </claim>
    <claim id="clm3" num="3">
      <p type="claim-text">如申請專利範圍第1或第2項所述的鑄鐵之石墨球狀化處理時的球狀化劑上部的覆蓋材，是將其外形製作成直徑5mm~10mm的球狀，或長度5mm~10mm的棒狀，一旦與鑄鐵的熔融金屬液接觸的話就會被熔解而浮出液面，可促進被設置在下部的石墨球狀化劑的反應。
</p>
    </claim>
    <claim id="clm4" num="4">
      <p type="claim-text">如申請專利範圍第1或第2項所述的鑄鐵之石墨球狀化處理時的球狀化劑上部的覆蓋材，其熔解溫度為1,100~1,200℃，熔解後會浮出液面，會與含有浮游雜質之爐渣結合而具有除滓劑的作用。
</p>
    </claim>
    <claim id="clm5" num="5">
      <p type="claim-text">如申請專利範圍第3項所述的鑄鐵之石墨球狀化處理時的球狀化劑上部的覆蓋材，其熔解溫度為1,100~1,200℃，熔解後會浮出液面，會與含有浮游雜質之爐渣結合而具有除滓劑的作用。
</p>
    </claim>
  </claims>
</tw-patent-grant>