<?xml version="1.0" encoding="utf-8"?>
<!DOCTYPE tw-patent-grant SYSTEM "patent.dtd">
<tw-patent-grant dtd-version="A103.1.0">
  <tw-bibliographic-data-grant>
    <volno>41</volno>
    <isuno>16</isuno>
    <kindcode>S</kindcode>
    <publication-reference>
      <document-id>
        <doc-number>D160743</doc-number>
        <kind />
        <date>103/06/01</date>
      </document-id>
    </publication-reference>
    <certificate-number>
      <document-id>
        <doc-number>D160743</doc-number>
        <kind />
        <date />
      </document-id>
    </certificate-number>
    <application-reference appl-type="design">
      <document-id>
        <doc-number>102301323</doc-number>
        <kind />
        <date>102/02/21</date>
      </document-id>
    </application-reference>
    <classification-locarno>
      <main-classification edition="9">02-01</main-classification>
    </classification-locarno>
    <parties>
      <applicants>
        <applicant sequence="1" app-type="applicant">
          <addressbook>
            <chinese-name name-type="">
              <last-name>陳瑞馨</last-name>
              <first-name></first-name>
            </chinese-name>
            <english-name name-type="">
              <last-name>CHEN, RUEY SHIN</last-name>
              <middle-name />
              <first-name />
            </english-name>
            <address>金門縣</address>
            <english-country>TW</english-country>
            <english-address>TW</english-address>
          </addressbook>
        </applicant>
      </applicants>
      <inventors>
        <inventor sequence="1" app-type="applicant">
          <addressbook>
            <chinese-name name-type="">
              <last-name>陳瑞馨</last-name>
              <first-name></first-name>
            </chinese-name>
            <english-name name-type="">
              <last-name>CHEN, RUEY SHIN</last-name>
              <middle-name></middle-name>
              <first-name></first-name>
            </english-name>
            <address></address>
            <english-country>TW</english-country>
            <english-address>TW</english-address>
          </addressbook>
        </inventor>
      </inventors>
      <agents></agents>
    </parties>
    <examiners>
      <examiner>
        <chinese-name>
          <last-name>陳慧媛</last-name>
          <first-name />
        </chinese-name>
      </examiner>
    </examiners>
    <priority-claims></priority-claims>
    <tw-bio-deposit></tw-bio-deposit>
    <invention-title>
      <chinese-title>褲子</chinese-title>
      <english-title />
    </invention-title>
    <refs>
      <ref>
        <country>US</country>
        <doc-number>D510791</doc-number>
        <kind></kind>
      </ref>
      <ref>
        <country>US</country>
        <doc-number>D603582</doc-number>
        <kind></kind>
      </ref>
    </refs>
    <application-publication-reference>
      <document-id>
        <doc-number></doc-number>
        <kind />
        <date></date>
      </document-id>
    </application-publication-reference>
  </tw-bibliographic-data-grant>
  <drawings num="">
    <figure>
      <img align="absmiddle" height="592px" width="492px" file="ed10001.JPG" alt="圖式IMG-2/Draw/ed10001.JPG" img-content="tif" img-format="tif" orientation="portrait" inline="yes"></img>
    </figure>
    <figure>
      <img align="absmiddle" height="482px" width="475px" file="ed10002.JPG" alt="圖式IMG-2/Draw/ed10002.JPG" img-content="tif" img-format="tif" orientation="portrait" inline="yes"></img>
    </figure>
    <figure>
      <img align="absmiddle" height="433px" width="493px" file="ed10003.JPG" alt="圖式IMG-2/Draw/ed10003.JPG" img-content="tif" img-format="tif" orientation="portrait" inline="yes"></img>
    </figure>
    <figure>
      <img align="absmiddle" height="350px" width="582px" file="ed10004.JPG" alt="圖式IMG-2/Draw/ed10004.JPG" img-content="tif" img-format="tif" orientation="portrait" inline="yes"></img>
    </figure>
    <figure>
      <img align="absmiddle" height="386px" width="589px" file="ed10005.JPG" alt="圖式IMG-2/Draw/ed10005.JPG" img-content="tif" img-format="tif" orientation="portrait" inline="yes"></img>
    </figure>
    <drawing-description>
      <p type="p">
        <p>本設計之特點在於其包括有：一件防漏褲子體(前視圖)是由防漏布料製造，並含有橢圓船型開口之排洩物承載袋(後視圖)、經由三向拉開之防漏拉鍊，即可方便地更換電子偵測裝置，尿布或尿片型之排洩物收集袋(使用狀態圖)。圖示所揭露之色彩為本案不主張之部分。
</p>
      </p>
      <p type="p">
        <p>1.因本設計為衣褲類，故只提供前視圖、使用狀態圖與後視圖與前視立體圖及後視立體圖，並省略其它視圖。
</p>
      </p>
    </drawing-description>
  </drawings>
  <claims />
</tw-patent-grant>